{
  "schema_version": "1.0.0",
  "package_version": "1.0.0",
  "target_framework": "VCGF",
  "target_framework_version": "1.3.0",
  "status": "final-integration-candidate",
  "activation_semantics": "explicit-journey-signals-only; no-cross-layer-auto-activation",
  "journeys": [
    {
      "id": "VCGF-UI-JRN-001",
      "journey": "DiscoveryToDetailReturn",
      "title": "الاكتشاف إلى التفاصيل والعودة",
      "priority": "P1",
      "version": "1.0.0",
      "status": "final-integration-candidate",
      "path": "journeys/VCGF-UI-JRN-001-DiscoveryToDetailReturn.md",
      "category": "discovery",
      "purpose": "الانتقال من بحث أو قائمة أو لوحة نتائج إلى سجل تفصيلي ثم العودة إلى موضع المستخدم وسياقه.",
      "applies_when": "نتائج البحث والقوائم وواجهات الاستكشاف التي يفتح منها المستخدم سجلًا ثم يتوقع الرجوع إلى نفس السياق.",
      "not_applicable_when": "لا يستخدم عندما لا توجد عودة ذات معنى إلى مصدر سابق أو عندما يكون الانتقال مقصودًا لبدء مهمة جديدة.",
      "triggers": [
        "search_to_detail",
        "list_to_detail_return",
        "result_to_record",
        "browse_return_context"
      ],
      "review_compositions": [
        "VCGF-UI-SCR-006",
        "VCGF-UI-SCR-002",
        "VCGF-UI-SCR-003"
      ],
      "review_components": [
        "VCGF-UI-COMP-002",
        "VCGF-UI-COMP-025",
        "VCGF-UI-COMP-030"
      ],
      "review_interactions": [
        "VCGF-UI-INT-003",
        "VCGF-UI-INT-021",
        "VCGF-UI-INT-024"
      ],
      "policies": [
        {
          "key": "entryPolicy",
          "type": "string",
          "default": "validated-entry",
          "scope": "system/tenant",
          "constraints": "تحدد طرق الدخول المقبولة ولا تسمح بتجاوز حراس المسار."
        },
        {
          "key": "completionPolicy",
          "type": "string",
          "default": "domain-confirmed",
          "scope": "system/tenant",
          "constraints": "النجاح يعتمد على تأكيد المجال لا على انتقال بصري فقط."
        },
        {
          "key": "returnPolicy",
          "type": "string",
          "default": "validated-origin",
          "scope": "system/tenant/user",
          "constraints": "العودة للأصل المسموح بعد إعادة التحقق، مع fallback آمن."
        },
        {
          "key": "contextPreservation",
          "type": "string",
          "default": "task-scoped",
          "scope": "system/tenant",
          "constraints": "يحفظ الحد الأدنى اللازم للمهمة دون أسرار أو بيانات نطاق سابق."
        },
        {
          "key": "authorizationRecheck",
          "type": "boolean",
          "default": true,
          "scope": "system/tenant",
          "constraints": "إعادة التحقق قبل الأثر المستمر والانتقال الحساس."
        },
        {
          "key": "telemetryMode",
          "type": "string",
          "default": "privacy-aware",
          "scope": "system/tenant",
          "constraints": "قياس مراحل الرحلة دون payload أعمال كامل أو أسرار."
        }
      ],
      "requirement_count": 12,
      "acceptance_count": 12
    },
    {
      "id": "VCGF-UI-JRN-002",
      "journey": "CreateToDetailContinuation",
      "title": "الإنشاء إلى التفاصيل والاستمرار",
      "priority": "P0",
      "version": "1.0.0",
      "status": "final-integration-candidate",
      "path": "journeys/VCGF-UI-JRN-002-CreateToDetailContinuation.md",
      "category": "record-lifecycle",
      "purpose": "إدارة رحلة إنشاء سجل ثم الانتقال إلى تفاصيله أو الاستمرار في سياق واضح دون فقد أصل المهمة.",
      "applies_when": "عندما ينشئ المستخدم كيانًا جديدًا ثم يحتاج فتحه أو إكمال بيانات مرتبطة أو العودة إلى مصدره.",
      "not_applicable_when": "لا ينطبق على نموذج مؤقت لا ينشئ سجلًا مستمرًا.",
      "triggers": [
        "create_to_detail",
        "create_then_open",
        "create_and_continue",
        "new_record_completion"
      ],
      "review_compositions": [
        "VCGF-UI-SCR-004",
        "VCGF-UI-SCR-003"
      ],
      "review_components": [
        "VCGF-UI-COMP-003",
        "VCGF-UI-COMP-025",
        "VCGF-UI-COMP-008"
      ],
      "review_interactions": [
        "VCGF-UI-INT-001",
        "VCGF-UI-INT-006",
        "VCGF-UI-INT-019",
        "VCGF-UI-INT-024"
      ],
      "policies": [
        {
          "key": "entryPolicy",
          "type": "string",
          "default": "validated-entry",
          "scope": "system/tenant",
          "constraints": "تحدد طرق الدخول المقبولة ولا تسمح بتجاوز حراس المسار."
        },
        {
          "key": "completionPolicy",
          "type": "string",
          "default": "domain-confirmed",
          "scope": "system/tenant",
          "constraints": "النجاح يعتمد على تأكيد المجال لا على انتقال بصري فقط."
        },
        {
          "key": "returnPolicy",
          "type": "string",
          "default": "validated-origin",
          "scope": "system/tenant/user",
          "constraints": "العودة للأصل المسموح بعد إعادة التحقق، مع fallback آمن."
        },
        {
          "key": "contextPreservation",
          "type": "string",
          "default": "task-scoped",
          "scope": "system/tenant",
          "constraints": "يحفظ الحد الأدنى اللازم للمهمة دون أسرار أو بيانات نطاق سابق."
        },
        {
          "key": "authorizationRecheck",
          "type": "boolean",
          "default": true,
          "scope": "system/tenant",
          "constraints": "إعادة التحقق قبل الأثر المستمر والانتقال الحساس."
        },
        {
          "key": "telemetryMode",
          "type": "string",
          "default": "privacy-aware",
          "scope": "system/tenant",
          "constraints": "قياس مراحل الرحلة دون payload أعمال كامل أو أسرار."
        }
      ],
      "requirement_count": 12,
      "acceptance_count": 12
    },
    {
      "id": "VCGF-UI-JRN-003",
      "journey": "DraftReviewSubmit",
      "title": "المسودة والمراجعة ثم الإرسال",
      "priority": "P0",
      "version": "1.0.0",
      "status": "final-integration-candidate",
      "path": "journeys/VCGF-UI-JRN-003-DraftReviewSubmit.md",
      "category": "draft-lifecycle",
      "purpose": "تنظيم العمل من بدء مسودة قابلة للاستئناف إلى المراجعة النهائية ثم الإرسال الموثوق.",
      "applies_when": "الطلبات والنماذج التي تسمح بالحفظ كمسودة قبل الإرسال أو تتطلب مراجعة المستخدم لمدخلاته.",
      "not_applicable_when": "لا يستخدم عندما لا يوجد مفهوم مسودة أو عندما يكون الحفظ نفسه هو الإجراء النهائي.",
      "triggers": [
        "draft_review_submit",
        "save_draft_then_submit",
        "review_before_submit",
        "resume_and_submit"
      ],
      "review_compositions": [
        "VCGF-UI-SCR-004",
        "VCGF-UI-SCR-005"
      ],
      "review_components": [
        "VCGF-UI-COMP-003",
        "VCGF-UI-COMP-011",
        "VCGF-UI-COMP-023"
      ],
      "review_interactions": [
        "VCGF-UI-INT-005",
        "VCGF-UI-INT-006",
        "VCGF-UI-INT-019",
        "VCGF-UI-INT-023"
      ],
      "policies": [
        {
          "key": "entryPolicy",
          "type": "string",
          "default": "validated-entry",
          "scope": "system/tenant",
          "constraints": "تحدد طرق الدخول المقبولة ولا تسمح بتجاوز حراس المسار."
        },
        {
          "key": "completionPolicy",
          "type": "string",
          "default": "domain-confirmed",
          "scope": "system/tenant",
          "constraints": "النجاح يعتمد على تأكيد المجال لا على انتقال بصري فقط."
        },
        {
          "key": "returnPolicy",
          "type": "string",
          "default": "validated-origin",
          "scope": "system/tenant/user",
          "constraints": "العودة للأصل المسموح بعد إعادة التحقق، مع fallback آمن."
        },
        {
          "key": "contextPreservation",
          "type": "string",
          "default": "task-scoped",
          "scope": "system/tenant",
          "constraints": "يحفظ الحد الأدنى اللازم للمهمة دون أسرار أو بيانات نطاق سابق."
        },
        {
          "key": "authorizationRecheck",
          "type": "boolean",
          "default": true,
          "scope": "system/tenant",
          "constraints": "إعادة التحقق قبل الأثر المستمر والانتقال الحساس."
        },
        {
          "key": "telemetryMode",
          "type": "string",
          "default": "privacy-aware",
          "scope": "system/tenant",
          "constraints": "قياس مراحل الرحلة دون payload أعمال كامل أو أسرار."
        }
      ],
      "requirement_count": 12,
      "acceptance_count": 12
    },
    {
      "id": "VCGF-UI-JRN-004",
      "journey": "ReviewApproveComplete",
      "title": "المراجعة والاعتماد والإكمال",
      "priority": "P0",
      "version": "1.0.0",
      "status": "final-integration-candidate",
      "path": "journeys/VCGF-UI-JRN-004-ReviewApproveComplete.md",
      "category": "approval",
      "purpose": "تنسيق انتقال عنصر العمل من المراجعة إلى قرار اعتماد ثم إغلاق أو تحويل المرحلة التالية مع دليل واضح.",
      "applies_when": "الموافقات والاعتمادات واللجان والمراجعات التي ينتج عنها قرار رسمي أو انتقال حالة.",
      "not_applicable_when": "لا يستخدم لعرض سجل تاريخي دون قرار قابل للتنفيذ.",
      "triggers": [
        "review_approve_complete",
        "approval_journey",
        "decision_to_complete",
        "approve_and_close"
      ],
      "review_compositions": [
        "VCGF-UI-SCR-008",
        "VCGF-UI-SCR-007"
      ],
      "review_components": [
        "VCGF-UI-COMP-012",
        "VCGF-UI-COMP-015",
        "VCGF-UI-COMP-016",
        "VCGF-UI-COMP-031"
      ],
      "review_interactions": [
        "VCGF-UI-INT-006",
        "VCGF-UI-INT-007",
        "VCGF-UI-INT-012",
        "VCGF-UI-INT-018"
      ],
      "policies": [
        {
          "key": "entryPolicy",
          "type": "string",
          "default": "validated-entry",
          "scope": "system/tenant",
          "constraints": "تحدد طرق الدخول المقبولة ولا تسمح بتجاوز حراس المسار."
        },
        {
          "key": "completionPolicy",
          "type": "string",
          "default": "domain-confirmed",
          "scope": "system/tenant",